Rep. Johnny T. Pimentel,CongJohnnyPimentel,285767998463304,POLITICIAN,PH,"This is the Official Facebook Page of Rep. Johnny T. Pimentel
",2018-03-31 11:02:43 SGT,N/A,N/A,2017-05-23 15:51:56 SGT,2017-05-23,15:51:56,Link,29,26,0,2,1,0,0,0,0,0,,-,0,0,0,N/A,https://www.facebook.com/285767998463304/posts/441281312911971,"The House committee on good government and public accountability chaired by Rep. Johnny T. Pimentel (2nd District, Surigao del Sur) conducting this week a hearing on the alleged anomalous purchase of minicabs, buses and trucks amounting to P66.4 million by several officials and employees of the provincial government of Ilocos Norte using funds from the province’s tobacco excise tax collection share. Attending the hearing were Ilocos Norte legal officer Erme Labayog and board member Da Vinci Crisostomo (upper middle photo), and officials of the Commission on Audit and Department of Budget and Management. The inquiry is based on House Resolution 882 filed by Majority Leader Rep. Rodolfo C. Farinas (left, upper left photo), Deputy Majority Leader Rep. Juan Pablo “Rimpy” P. Bondoc and Rep. Aurelio “Dong” D. Gonzales, Jr. (right, lower photo). The committee cited for contempt several officials and employees of the provincial government of Ilocos Norte for snubbing twice the panel’s invitation to shed light on the alleged anomaly. Per Republic Act 7171, the excise tax collection share is for the self-reliance advancement of tobacco farmers. The purchases were allegedly made without public bidding. (truncated)",http://www.congress.gov.ph/photojournal/zoom.php?photoid=1200,,,House of Representatives,"The House committee on good government and public accountability chaired by Rep. Johnny T. Pimentel (2nd District, Surigao del Sur) conducting this week a hearing on the alleged anomalous purchase of minicabs, buses and trucks amounting to P66.4 million by several officials and employees of the prov...",,,,-1.9
Dax Cua,dakilacua,100044398330619,PERSON,PH,This is the official Facebook Page of Quirino Governor Dax Cua. ,2018-07-06 13:03:25 SGT,N/A,N/A,2018-05-20 09:00:55 SGT,2018-05-20,09:00:55,Photo,24,23,0,0,1,0,0,0,0,0,,-,0,0,0,N/A,https://www.facebook.com/656115028113734/posts/657443581314212,"Members of the House committee on ways and means chaired by Rep. Dakila Carlo Cua listen intently as officials of the Bureau of Customs (BOC) brief them Tuesday. Two important issues were tackled namely: the illegal withdrawal from the BOC-Port of Manila premises operated by the Asian Terminals Inc. (ATI), of at least 105 containers covered by manual alert orders; and the smuggling of 17 containers of onions at the BOC-Manila International Container Port (MICP) premises operated by the International Container Terminal Services, Inc. (ICTSI). With Cua are Rep. Gloria Macapagal-Arroyo, Deputy Speaker Romero Quimbo, Reps. Lianda Bolilia, Horacio Suansing Jr., Prospero Pichay, and Rosemarie ""Baby"" Arenas. Source: Press and Public Affairs Bureau http://www.congress.gov.ph/photojournal/zoom.php?photoid=1497",https://www.facebook.com/dakilacua/photos/a.656583438066893/657443561314214/?type=3,,,,,,,,-1.88
TUCP Party-List,TUCPPL,112665659649,NONPROFIT ORGANIZATION,PH,Trade Union Congress of the Philippines,2019-10-29 15:38:02 SGT,41060,41110,2019-11-05 12:45:00 SGT,2019-11-05,12:45:00,Link,23,19,1,2,1,0,0,0,0,0,,-,0,0,0,N/A,https://www.facebook.com/112665659649/posts/10157625429749650,"GOV'T OFFICIALS BACK DOFW BILL Officials from the Labor and Employment, Foreign Affairs and Budget Departments, Philippine Overseas Employment Administration (POEA) and Overseas Workers Welfare Administration (OWWA) on Wednesday expressed their full support for the creation of the Department of Overseas Filipino Workers (DOFW) as being pushed by Speaker Alan Peter ""Compañero"" Cayetano, Deputy Speaker Paolo Duterte and Rep. Maria Laarni Cayetano, authors of House Bill No. 2. Their expression of support was manifested during Day 2 of the joint meeting of the House Committees on Government Reorganization and Overseas Workers Affairs. Source: http://www.congress.gov.ph/photojournal/zoom.php?photoid=2122&key=Department%20OFW",http://www.congress.gov.ph/photojournal/zoom.php?photoid=2122&key=Department+OFW,,,House of Representatives,"Officials from the Labor and Employment, Foreign Affairs and Budget Departments, Philippine Overseas Employment Administration (POEA) and Overseas Workers Welfare Administration (OWWA) on Wednesday expressed their full support for the creation of the Department of Overseas Filipino Workers (DOFW) as...",,,,1.05
Democracy Watch Philippines,democracywatchph,541246799278871,POLITICAL ORGANIZATION,PH,A Citizen-Led Democratic Initiative,2021-01-06 16:31:41 SGT,N/A,N/A,2017-03-20 08:05:42 SGT,2017-03-20,08:05:42,Link,22,14,1,7,0,0,0,0,0,0,,-,0,0,0,N/A,https://www.facebook.com/541246799278871/posts/1400503856686490,"The PDP-Laban Federalism Institute, Foundation for Economic Freedom, Stratbase ADR Institute (ADRi), Democracy Watch, and Congressional Policy and Budget Research Department (CPBRD) held a forum last March 8, 2017 on ""Amending the Economic Provisions of the Constitution."" The forum is part of the Federalism and Constitutional Reform Dialogue Series.",http://www.congress.gov.ph/photojournal/zoom.php?photoid=1166,,,House of Representatives,"The PDP-Laban Federalism Institute, Foundation for Economic Reform, Stratbase Albert del Rosario Institute (ADRi), Democracy Watch, and Congressional Policy and Budget Research Department (CPBRD) held a forum last March 8, 2017 on ""Amending the Economic Provisions of the Constitution."" The forum is…",,,,-2.27
Hinirang,Hinirangiglesianicristo,2005782399647219,COMMUNITY,PH,Temp. unofficial facebook page of the Iglesia Ni Cristo | Church Of Christ,2021-01-15 10:21:30 SGT,N/A,N/A,2017-08-14 11:25:31 SGT,2017-08-14,11:25:31,Link,22,19,0,0,3,0,0,0,0,0,,-,0,0,0,N/A,https://www.facebook.com/2005782399647219/posts/2354090204816435,,https://www.facebook.com/138133363045156/posts/738730912985395/,https://www.facebook.com/login/?next=https%3A%2F%2Fwww.facebook.com%2F138133363045156%2Fposts%2F738730912985395%2F,,This is a re-share of a post,"INC anniversary bilang non-working holiday, pasado sa Kamara

INAPRUBAHAN na sa ikatlo at huling pagbasa ang panukalang batas na ibilang na special non-working holiday ang anibersaryo ng Iglesia ni Cristo (INC).

Batay sa House Bill 5686, tuwing anibersaryo ng Iglesia Ni Cristo na July 27 ay idedeklara itong non-working holiday.

Ang pagpapasa sa panukala ay isinagawa kaalinsabay ng ika-103 taong anibersaryo ng INC na inaprubahan ng may 242 kongresista.

Ang panukalang ito ay pinagsama-samang panukala nina Reps. Winston Castelo (PDP-Laban, Quezon City); Alfred Vargas (PDP-Laban, QC); Eugene de Vera (ABS Partylist); Gil P. Acosta (NP, Palawan); Gus Tambunting (PDP-Laban, Parañaque City) at Romeo Acop (LP, Antipolo City).

Sinabi ni Castelo na inaamyendahan ng HB 5686 ang Republic Act No. 9645 o mas kilala bilang Commemoration of the Founding Anniversary of Iglesia Ni Cristo Act, sa pamamagitan ng pagdedeklara ng July 27 bilang non-working holiday.

Paliwanag ni Castelo, chairman ng House Committee on Metro Manila Development, ito’y upang mabigyan ng pagkakataon ang mga Pilipino na miembro ng INC na maipagdiwang ang anibersaryo tuwing July 27.

Samantala, naipasa na sa Committee on Rules ang House Resolution 1163 na nagpapahatid ng pagbati sa ika-103 anibersaryo ng Iglesia Ni Cristo nitong nagdaang July 27, 2017 at ang House Resolution 1167 na nagpapahatid naman ng pagbati sa walong taong matagumpay na pangunguna ni Iglesia Ni Cristo Executive Minister Eduardo V. Manalo. 

Related :
http://www.congress.gov.ph/legisdocs/third_17/HBT5686.pdf
http://www.congress.gov.ph/legisdocs/first_17/CR00250.pdf
http://www.congress.gov.ph/photojournal/zoom.php?photoid=1254&key=House%20Bill%205686
http://www.abante-tonite.com/inc-anniv-idineklarang-holiday.htm:=:https://tonite.abante.com.ph/inc-anniv-idineklarang-holiday.htm",,,,-3.09
Congresswoman Juliette Uy,juliettetuy,1691279514424980,PUBLIC SERVICE,PH,Tinud-anay nga Serbisyo ug Pulido nga Proyekto,2018-03-31 12:28:45 SGT,N/A,N/A,2017-05-31 11:57:28 SGT,2017-05-31,11:57:28,Photo,21,20,0,0,1,0,0,0,0,0,,-,0,0,0,N/A,https://www.facebook.com/1691279514424980/posts/1972023186350610,,https://www.facebook.com/339957112804069/photos/a.1067179023415204.1073741863.339957112804069/1067179050081868/?type=3,,,Juliette Uy,"The Committee on Tourism of the House of Representatives has recently approved a measure that aims to declare the province of Misamis Oriental as a tourism development area.

Misamis Oriental Rep. Juliette Uy (2nd District), author of House Bill 2128 titled An Act Declaring the Province of Misamis Oriental as a Tourism Development Area and Appropriating Funds Therefor, profusely thanked Leyte Rep. Lucy Torres-Gomez, Tourism Committee Chair for the panel's approval of the measure. You may also look at this link: http://www.congress.gov.ph/photojournal/zoom.php?photoid=1201",,,,-10.95
Iglesia Ni Cristo (open forum),,1450262228606994,none,,,2020-03-07 15:40:28 SGT,N/A,N/A,2017-08-14 19:13:45 SGT,2017-08-14,19:13:45,Link,21,16,2,2,0,1,0,0,0,0,,-,0,0,0,N/A,https://www.facebook.com/groups/1450262228606994/permalink/1758101154489765,,https://www.facebook.com/138133363045156/posts/738730912985395/,,,This is a re-share of a post,"INC anniversary bilang non-working holiday, pasado sa Kamara

INAPRUBAHAN na sa ikatlo at huling pagbasa ang panukalang batas na ibilang na special non-working holiday ang anibersaryo ng Iglesia ni Cristo (INC).

Batay sa House Bill 5686, tuwing anibersaryo ng Iglesia Ni Cristo na July 27 ay idedeklara itong non-working holiday.

Ang pagpapasa sa panukala ay isinagawa kaalinsabay ng ika-103 taong anibersaryo ng INC na inaprubahan ng may 242 kongresista.

Ang panukalang ito ay pinagsama-samang panukala nina Reps. Winston Castelo (PDP-Laban, Quezon City); Alfred Vargas (PDP-Laban, QC); Eugene de Vera (ABS Partylist); Gil P. Acosta (NP, Palawan); Gus Tambunting (PDP-Laban, Parañaque City) at Romeo Acop (LP, Antipolo City).

Sinabi ni Castelo na inaamyendahan ng HB 5686 ang Republic Act No. 9645 o mas kilala bilang Commemoration of the Founding Anniversary of Iglesia Ni Cristo Act, sa pamamagitan ng pagdedeklara ng July 27 bilang non-working holiday.

Paliwanag ni Castelo, chairman ng House Committee on Metro Manila Development, ito’y upang mabigyan ng pagkakataon ang mga Pilipino na miembro ng INC na maipagdiwang ang anibersaryo tuwing July 27.

Samantala, naipasa na sa Committee on Rules ang House Resolution 1163 na nagpapahatid ng pagbati sa ika-103 anibersaryo ng Iglesia Ni Cristo nitong nagdaang July 27, 2017 at ang House Resolution 1167 na nagpapahatid naman ng pagbati sa walong taong matagumpay na pangunguna ni Iglesia Ni Cristo Executive Minister Eduardo V. Manalo. 

Related :
http://www.congress.gov.ph/legisdocs/third_17/HBT5686.pdf
http://www.congress.gov.ph/legisdocs/first_17/CR00250.pdf
http://www.congress.gov.ph/photojournal/zoom.php?photoid=1254&key=House%20Bill%205686
http://www.abante-tonite.com/inc-anniv-idineklarang-holiday.htm",,,,1.11
Rep. Johnny T. Pimentel,CongJohnnyPimentel,285767998463304,POLITICIAN,PH,"This is the Official Facebook Page of Rep. Johnny T. Pimentel
",2018-03-31 11:02:43 SGT,N/A,N/A,2017-08-24 11:01:57 SGT,2017-08-24,11:01:57,Link,20,16,1,1,2,0,0,0,0,0,,-,0,0,0,N/A,https://www.facebook.com/285767998463304/posts/484402645266504,The Committee on Good Government and Public Accountability is headed by Surigao del Sur - 2nd District Representative Johnny T. Pimentel. #kanatoini #parasabayan http://www.congress.gov.ph/photojournal/zoom.php?photoid=1287,http://www.congress.gov.ph/photojournal/zoom.php?photoid=1287,,,House of Representatives,"The House committee on good government and public accountability, chaired by Rep. Johnny Pimentel (2nd District, Surigao del Sur) on Wednesday resumed its inquiry into the alleged misuse of the tobacco excise tax collection such as the alleged highly irregular purchase by the Provincial Government o...",,,,-2.75
"Atty. Reynaldo ""RU"" Umali",ReyUmaliOnline,1440546389501680,GOVERNMENT OFFICIAL,PH,"3rd-termer Representative, 2nd District of Oriental Mindoro. 
Chairman, Committee on Justice, House of Representatives.",2018-03-31 10:23:45 SGT,N/A,N/A,2017-03-07 10:42:03 SGT,2017-03-07,10:42:03,Link,19,17,0,2,0,0,0,0,0,0,,-,0,0,0,N/A,https://www.facebook.com/1440546389501680/posts/1842104966012485,,http://www.congress.gov.ph/photojournal/zoom.php?photoid=1154,,,House of Representatives,"House committee on justice chairman Rep. Reynaldo V. Umali (2nd District, Mindoro Oriental) refreshed the antecedents leading to the arrest of Sen. Leila de Lima last week. Umali, along with Deputy Speaker and Cebu Third District Rep. Gwendolyn ""Gwen"" Garcia and Rep. Estrellita B. Suansing (1st Dist...",,,,-4
"Atty. Reynaldo ""RU"" Umali",ReyUmaliOnline,1440546389501680,GOVERNMENT OFFICIAL,PH,"3rd-termer Representative, 2nd District of Oriental Mindoro. 
Chairman, Committee on Justice, House of Representatives.",2018-03-31 10:23:45 SGT,N/A,N/A,2017-12-06 14:18:20 SGT,2017-12-06,14:18:20,Photo,18,17,0,1,0,0,0,0,0,0,,-,0,0,0,N/A,https://www.facebook.com/1440546389501680/posts/1964039520485695,📸:http://www.congress.gov.ph/photojournal/zoom.php?photoid=1374,https://www.facebook.com/ReyUmaliOnline/photos/a.1488382568051395/1964039407152373/?type=3,,,,,,,,-5.17
Good Neighbors Philippines,goodneighborsph,164383173624513,NONPROFIT ORGANIZATION,PH,"Good Neighbors Philippines is an international, child-focused, humanitarian, and development  NGO. ",2020-03-27 15:18:51 SGT,N/A,N/A,2013-12-03 10:41:55 SGT,2013-12-03,10:41:55,Link,18,18,0,0,0,0,0,0,0,0,,-,0,0,0,N/A,https://www.facebook.com/164383173624513/posts/614766991919460,GNIP-Child Rights Council from San Isidro Community Development Project represented Good Neighbors Philippines in the poster-making contest during the National Children's Month celebration at the House of Representatives last October. They nailed it. Proud of our youth representatives!,http://www.congress.gov.ph/photojournal/zoom.php?photoid=834,,,HOUSE OF REPRESENTATIVES | 16th Congress of the Philippines,"PROTECTING THE FUTUREPhoto credit: Gilbert Engay, Media Relations Service-PRIB22 October 2013 06:27:02 PMIn support of the global campaign to protect ""Children's rights today and tomorrow,"" the Committee on the Welfare of Children of the House of Representatives, in partnership with the Child Rights...",,,,-3.78
Stratbase ADR Institute,stratbaseadri,1512452085732585,CONSULATE & EMBASSY,PH,The Stratbase Albert del Rosario Institute for Strategic and International Studies (ADRi) is an independent international and strategic research organization with the principal goal of addressing the issues affecting the Philippines and East Asia.,2021-02-22 07:55:46 SGT,N/A,N/A,2017-03-20 08:05:15 SGT,2017-03-20,08:05:15,Link,18,9,0,9,0,0,0,0,0,0,,-,0,0,0,N/A,https://www.facebook.com/1512452085732585/posts/1749714292006362,"The PDP-Laban Federalism Institute, Foundation for Economic Freedom, Stratbase Albert del Rosario Institute (ADRi), Democracy Watch Philippines, and Congressional Policy and Budget Research Department (CPBRD) held a forum last March 8, 2017 on ""Amending the Economic Provisions of the Constitution."" The forum is part of the Federalism and Constitutional Reform Dialogue Series.",http://www.congress.gov.ph/photojournal/zoom.php?photoid=1166,https://www.congress.gov.ph/photojournal/zoom.php?photoid=1166,,House of Representatives,"The PDP-Laban Federalism Institute, Foundation for Economic Reform, Stratbase Albert del Rosario Institute (ADRi), Democracy Watch, and Congressional Policy and Budget Research Department (CPBRD) held a forum last March 8, 2017 on ""Amending the Economic Provisions of the Constitution."" The forum is…",,,,0.95
Team Flores,TeamFloresKami,2026831494003990,POLITICIAN,,Politician,2021-02-23 18:43:06 SGT,N/A,N/A,2020-02-20 11:19:18 SGT,2020-02-20,11:19:18,Photo,17,15,0,1,0,0,0,0,0,1,,-,0,0,0,N/A,https://www.facebook.com/2026831494003990/posts/2881540938533037,"As the Vice Chairman of the Committee on Justice in the Lower Congress, I presided over a recent meeting whereby we discussed HB No. 2993 or the ""Legal Aid Program Act of 2019."" This bill aims to institutionalize a clinical LEGAL EDUCATION program in all public and private law schools in the country. This means ALL law students will be asked to provide FREE legal assistance especially to the underprivileged before they take the bar exam. The principal author of the bill is Rizal 2nd District Rep. Juan Fidel Felipe Nograles. #HustoKaJohn #Bukidnon2ndDistrict",https://www.facebook.com/attyjohnfloresbukidnon/photos/a.1278245892268687/2762352837191311/?type=3,,,"Husto Ka, John","As the Vice Chairman of the Committee on Justice in the Lower Congress, I presided over a recent meeting whereby we discussed HB No. 2993 or the ""Legal Aid Program Act of 2019."" 

This bill aims to institutionalize a clinical LEGAL EDUCATION program in all public and private law schools in the country. This means ALL law students will be asked to provide FREE legal assistance especially to the underprivileged before they take the bar exam. 

The principal author of the bill is Rizal 2nd District Rep. Juan Fidel Felipe Nograles. 

#HustoKaJohn
#Bukidnon2ndDistrict 

Posted on the official House of Representatives Journal: http://www.congress.gov.ph/photojournal/zoom.php?photoid=2275&key=jonathan%20keith%20flores:=:https://www.congress.gov.ph/photojournal/zoom.php?photoid=2275&key=jonathan%2520keith%2520flores",,,,0.89
Recoboda Partylist,RecobodaPartylist,2006989719608216,POLITICAL ORGANIZATION,PH,"Official Page of RECOBODA Partylist - Rural Electric Consumers and Beneficiaries of Development and Advancement. 

RECOBODA's elected official is Engr. Godofredo ""Fred"" Guya.
Rep. Fred Guya is a proud Power Bloc Representative in the 18th Congress.",2020-06-04 16:47:25 SGT,2914,2969,2020-09-18 09:00:39 SGT,2020-09-18,09:00:39,Photo,17,16,0,0,1,0,0,0,0,0,,-,0,0,0,N/A,https://www.facebook.com/2006989719608216/posts/2443779725929211,"During the House Committee on Energy yesterday, house panel approved bills to ensure affordable electricity for low-income households and health crisis. 💡 The body approved a proposal that would mandate the extension of the implementation of the lifeline rate until 2041. This would allow low-income Filipino households continued affordable access to electricity amid the pandemic. The approved bill consolidated House Bills 7059 and 7341 seeking to extend the implementation of the lifeline rate, amending for the purpose Section 73 of Republic Act 9136, otherwise known as the “Electric Power Industry Reform Act (EPIRA). Committee Vice Chair Rep. Presley De Jesus, who presided over the meeting, emphasized that the lifeline rate supports consumers incapable of paying for the full cost by providing a subsidized electricity rate. | 📷 via Press and Public Affairs Bureau, House of Representatives READ MORE: http://www.congress.gov.ph/photojournal/zoom.php?photoid=2520&fbclid=IwAR1x4p-FaPhKnTx13xFtsnNFeUPJkb66MRV5KOKeaqByaXe0ILpyq7EFZQI",https://www.facebook.com/RecobodaPartylist/photos/a.2034108213563033/2443777642596086/?type=3,,,Photos from Recoboda Partylist's post,,,,,-2.88
Diskurso Malaybalay,,126454552003596,none,,,2020-03-12 14:23:08 SGT,N/A,N/A,2020-02-20 10:54:35 SGT,2020-02-20,10:54:35,Photo,17,16,0,1,0,0,0,0,0,0,,-,0,0,0,N/A,https://www.facebook.com/groups/126454552003596/permalink/131338098181908,,https://www.facebook.com/attyjohnfloresbukidnon/photos/a.1278245892268687/2762352837191311/?type=3,,,"Husto Ka, John","As the Vice Chairman of the Committee on Justice in the Lower Congress, I presided over a recent meeting whereby we discussed HB No. 2993 or the ""Legal Aid Program Act of 2019."" 

This bill aims to institutionalize a clinical LEGAL EDUCATION program in all public and private law schools in the country. This means ALL law students will be asked to provide FREE legal assistance especially to the underprivileged before they take the bar exam. 

The principal author of the bill is Rizal 2nd District Rep. Juan Fidel Felipe Nograles. 

#HustoKaJohn
#Bukidnon2ndDistrict 

Posted on the official House of Representatives Journal: http://www.congress.gov.ph/photojournal/zoom.php?photoid=2275&key=jonathan%20keith%20flores",,,,-3.12
MALAYBALAY CITY EXCLUSIVE                          (McX),,748816895185052,none,,,2020-03-08 15:05:05 SGT,N/A,N/A,2020-02-20 11:23:14 SGT,2020-02-20,11:23:14,Photo,17,15,1,0,1,0,0,0,0,0,,-,0,0,0,N/A,https://www.facebook.com/groups/748816895185052/permalink/2752160808183974,,https://www.facebook.com/attyjohnfloresbukidnon/photos/a.1278245892268687/2762352837191311/?type=3,,,"Husto Ka, John","As the Vice Chairman of the Committee on Justice in the Lower Congress, I presided over a recent meeting whereby we discussed HB No. 2993 or the ""Legal Aid Program Act of 2019."" 

This bill aims to institutionalize a clinical LEGAL EDUCATION program in all public and private law schools in the country. This means ALL law students will be asked to provide FREE legal assistance especially to the underprivileged before they take the bar exam. 

The principal author of the bill is Rizal 2nd District Rep. Juan Fidel Felipe Nograles. 

#HustoKaJohn
#Bukidnon2ndDistrict 

Posted on the official House of Representatives Journal: http://www.congress.gov.ph/photojournal/zoom.php?photoid=2275&key=jonathan%20keith%20flores",,,,-7.41
TUCP Labor Center,TUCPLaborCenter,164957537514514,NONPROFIT ORGANIZATION,PH,"The Trade Union Congress of the Philippines (TUCP), with 480,000 members, is the biggest confederation of labor federations in the Philippines both in membership and in number of Collective Bargaining Agreements. It was founded on December 14, 1975 by 23 ",2021-01-15 10:16:22 SGT,N/A,N/A,2019-11-05 12:15:01 SGT,2019-11-05,12:15:01,Link,16,13,0,2,1,0,0,0,0,0,,-,0,0,0,N/A,https://www.facebook.com/164957537514514/posts/411299019547030,"GOV'T OFFICIALS BACK DOFW BILL Officials from the Labor and Employment, Foreign Affairs and Budget Departments, Philippine Overseas Employment Administration (POEA) and Overseas Workers Welfare Administration (OWWA) on Wednesday expressed their full support for the creation of the Department of Overseas Filipino Workers (DOFW) as being pushed by Speaker Alan Peter ""Compañero"" Cayetano, Deputy Speaker Paolo Duterte and Rep. Maria Laarni Cayetano, authors of House Bill No. 2. Their expression of support was manifested during Day 2 of the joint meeting of the House Committees on Government Reorganization and Overseas Workers Affairs. Source: http://www.congress.gov.ph/photojournal/zoom.php?photoid=2122&key=Department%20OFW",http://www.congress.gov.ph/photojournal/zoom.php?photoid=2122&key=Department+OFW,,,House of Representatives,"Officials from the Labor and Employment, Foreign Affairs and Budget Departments, Philippine Overseas Employment Administration (POEA) and Overseas Workers Welfare Administration (OWWA) on Wednesday expressed their full support for the creation of the Department of Overseas Filipino Workers (DOFW) as...",,,,0.84
Ferdinand L. Hernandez,CongDinandHernandez,910078755764368,PUBLIC & GOVERNMENT SERVICE,PH,"Deputy House Speaker Ferdinand L. Hernandez is the Congressman of the 2nd District of South Cotabato. He is now on his second term as representative.

",2017-07-22 15:35:15 SGT,N/A,N/A,2017-02-13 17:27:48 SGT,2017-02-13,17:27:48,Link,15,14,0,1,0,0,0,0,0,0,,-,0,0,0,N/A,https://www.facebook.com/910078755764368/posts/1041221525983423,http://www.congress.gov.ph/photojournal/zoom.php?photoid=1142,http://www.congress.gov.ph/photojournal/zoom.php?photoid=1142,,,House of Representatives,"The House of Representatives, along with the PDP-Laban Federalism Institute, Congressional Policy and Budget Research Department (CPBRD), and Local Government Development Foundation(LOGODEF) recently sponsored the forum ""The Dual Executive and Semi-Presidentialism."" It highlighted the importance of…",,,,-25.67
Gov. Gwen Garcia,GwenGarciaCebuOfficial,161542770688841,GOVERNMENT OFFICIAL,PH,"The official Facebook Fanpage of Cebu Governor Gwendolyn Garcia. She was three term Governor of Cebu from 2004-2013, then became Congresswoman of the 3rd District of Cebu from 2013-2019. She won as governor again last May 2019 Elections.

Created 2013.",2017-07-22 15:13:04 SGT,N/A,N/A,2014-03-04 18:43:32 SGT,2014-03-04,18:43:32,Link,15,15,0,0,0,0,0,0,0,0,,-,0,0,0,N/A,https://www.facebook.com/161542770688841/posts/10200810662708434,Woman Power,http://www.congress.gov.ph/photojournal/zoom.php?photoid=874,,,HOUSE OF REPRESENTATIVES | 16th Congress of the Philippines,"WOMAN POWERPhoto credit: Pecto Camero, Media Relations Service-PRIB 04 March 2014 03:06:44 PMUshering the celebration of the International Women's Month, the 79-strong women-caucus - Association of Women Legislators Foundation, Inc., - of the House of Representatives took over plenary proceedings la...",,,,-16.73
