AAMBIS-Owa Party-list,aambis,280225918225,COMMUNITY ORGANIZATION,PH,"AAMBIS-Owa Party List is the farmers' voice in the Philippine House of Representatives. 

(Due to GCQ, we will be adopting a skeleton workforce from Monday to Thursday, 8am - 7pm. For immediate concerns, kindly reach out to us through 09228399731. )",2018-03-31 11:55:50 SGT,N/A,N/A,2014-09-14 08:00:01 SGT,2014-09-14,08:00:01,Link,5,4,0,1,0,0,0,0,0,0,,-,0,0,0,N/A,https://www.facebook.com/280225918225/posts/10152408570543226,"Rep. Sharon Garin joined Speaker Feliciano Belmonte Jr., Rep. Rose Marie ""Baby"" Arenas, and Rep. Raneu Abu in welcoming H. E. Julio Camarena Villasenor, Ambassador, Extraordinary and Plenipotentiary ofthe United Mexican States Embassy in the Philippines on February 20, 2014 at the House of Representatives. http://www.congress.gov.ph/photojournal/zoom.php?photoid=871",http://www.congress.gov.ph/photojournal/zoom.php?photoid=871,,,HOUSE OF REPRESENTATIVES | 16th Congress of the Philippines,"COMMON VISIONPhoto credit: Tobias Engay, Media Relations Service-PRIB20 February 2014 05:43:07 PMSpeaker Feliciano Belmonte, Jr. (2nd from left) and H.E. Julio Camarena Villasenor, Ambassador, Extraordinary and Plenipotentiary of the United Mexican States Embassy in the Philippines (center) exchange…",,,,-5.2
PRESIDENT RODRIGO ROA DUTERTE in Ideas & in Action,,1629728733908586,none,,,2017-12-07 20:56:25 SGT,7748,N/A,2018-01-20 06:57:22 SGT,2018-01-20,06:57:22,Photo,5,3,0,2,0,0,0,0,0,0,,-,0,0,0,N/A,https://www.facebook.com/groups/1629728733908586/permalink/1986661571548632,"SERENO’S LAND CRUISER QUESTIONED ""The House committee on justice questioned the use of public funds for the purchase of a P5-million brand-new Toyota Land Cruiser 2017 model for personal use by Supreme Court Chief Justice Maria Lourdes Sereno, aside from the Hyundai Grand Starex Gold already assigned to her. The purchase of the Toyota Land Cruiser is one of the allegations in the impeach complaint filed against Sereno by Atty. Lorenzo Gadon.""",https://www.facebook.com/ReyUmaliOnline/photos/a.1488382568051395/1982124572010523/?type=3,,,"Atty. Reynaldo ""RU"" Umali","SERENO’S LAND CRUISER QUESTIONED

""The House committee on justice questioned the use of public funds for the purchase of a P5-million brand-new Toyota Land Cruiser 2017 model for personal use by Supreme Court Chief Justice Maria Lourdes Sereno, aside from the Hyundai Grand Starex Gold already assigned to her. The purchase of the Toyota Land Cruiser is one of the allegations in the impeach complaint filed against Sereno by Atty. Lorenzo Gadon.""

From: House of Representatives of the Philippines Photo Journals

Source: http://www.congress.gov.ph/photojournal/zoom.php?photoid=1392",,,,-7
Knesset Christian Allies Caucus,KnessetChristianAlliesCaucus,158356400908680,POLITICAL ORGANIZATION,IL,Please 'LIKE' the Knesset Christian Allies Caucus- strengthening coordination between the Israeli parliament and Christian leaders around the world.,2017-04-14 01:43:44 SGT,N/A,N/A,2011-11-16 22:37:54 SGT,2011-11-16,22:37:54,Link,4,3,1,0,0,0,0,0,0,0,,-,0,0,0,N/A,https://www.facebook.com/158356400908680/posts/233049446762554,The Knesset Christian Allies Caucus met with the Speaker of the Philippines House of Representatives,http://www.congress.gov.ph/photojournal/zoom.php?photoid=623,,,House of Representatives - 15th Congress of the Philippines,description,,,,-20
Die hard supporters PRRD,,2429891717244603,none,,,2020-03-20 05:53:08 SGT,N/A,N/A,2019-09-04 17:30:34 SGT,2019-09-04,17:30:34,Link,4,3,0,0,0,1,0,0,0,0,,-,0,0,0,N/A,https://www.facebook.com/groups/2429891717244603/permalink/2504667919766982,,http://www.congress.gov.ph/photojournal/zoom.php?photoid=2102,,,House of Representatives,"Rep. Jocelyn Pua-Tulfo (Party-list, ACT CIS) was the guest speaker during the flag raising ceremony of the House of Representatives Secretariat on Monday. In her speech, Tulfo said that prior to her election as party-list representative in Congress, she was just a plain housewife and little did she....",,,,-5.25
KABATAAN PARTYLIST,kabataan,194908320556,POLITICAL ORGANIZATION,PH,"The first and only youth sectoral party in Philippine Congress.

Join Kabataan Partylist! :)",2016-04-12 21:33:44 SGT,176570,174898,2019-09-24 16:33:55 SGT,2019-09-24,16:33:55,Link,3,2,0,1,0,0,0,0,0,0,,-,0,0,0,N/A,https://www.facebook.com/194908320556/posts/10162230404940557,"23 September 2019 Youth and Sports Committee Meeting The House Committee on Youth and Sports Development chaired by Rep. Eric Martinez (2nd District, Valenzuela City) on Monday held its organizational meeting to discuss and approve its rules of procedure. The committee was also apprised by Philippine Sports Commission Chairman William Ramirez on the preparations for the 30th Southeast Asian Games to be held in Manila from November 30 to December 10, 2019. Martinez asked if the P7.5 billion budget for the SEAG preparations will guarantee the overall championship of the Philippines in the sports event. He cited that in 1991, host Philippines emerged as the overall champion of the SEAG. Ramirez said the heart and soul of the SEAG is the athletes. He also clarified that the SEAG budget was slashed by the Senate from P7.5 billion to P6 billion and eventually to P5 billion. Ramirez said through the initiative of House Speaker Alan Peter ""Compañero"" Cayetano, an additional P1 billion was raised to keep the budget at P6 billion. The Speaker is Chairman of the Philippine Southeast Asian Games Organizing Committee (PHISGOC). http://www.congress.gov.ph/photojournal/zoom.php?photoid=2130 Things that was discussed: 1.Proposed Rules of Procedure of the Committee on Youth and Sports Development 2. Sports athletes/competitions commendation of the House 3. 30th SEA Games For the 30th South East Asian Games, Philippine Sports Commission Issue(s): Procurement of equipment (they will rent instead & it will reflect on their MOOE) Several sponsors pitched in to discuss the ff: TEMPLATE THAT WAS USED BY THE GOVT. (They used what the Asian Continental Games look and operates. It will have an Asian games quality, 11,000 officials and athletes; 9,000 volunteers to run and operate the program.) VENUES PLACEMENT. (Since 1934, this is the only time that PH will have its own facilities, its still far from the likes of Singapore or Thailand but, they are getting there.) TEST VENUES. (2 test venues in Clark, but it is only in La Union where the surfing events can be conducted, everything was pursuant to International Standards) PROCUREMENT STATUS. (P 3.3 Billion pesos allotment, 30 are moving and out of that 30, 2 were already awarded for the designs, P 300 M for the venues technical requirements, business uniforms, casual uniforms, etc. were awarded as well) MARKETING. (There will be billboard signage, promoting the SEA Games, local district representatives were also asked to help with the promotion, by October 1, they will air TV commercials to Major TV networks, by the 15th, it will be the awarding for procurement services, livestreaming of some 11 sports while others will get highlights) ATHLETES VILLAGE. (furnishing only e.g. painting of doors etc.) FOOD. (they have a master plan for catering, whereas halal food will also be served especially to members of the Islamic Community) TICKETS. (General admission worth 50 pesos, they will also try to persuade LGUs to have them invite students to watch the games) BY OCTOBER 15, EVERYTHING WILL BE GOOD TO GO.",http://www.congress.gov.ph/photojournal/zoom.php?photoid=2130,,,House of Representatives,"The House Committee on Youth and Sports Development chaired by Rep. Eric Martinez (2nd District, Valenzuela City) on Monday held its organizational meeting to discuss and approve its rules of procedure. The committee was also apprised by Philippine Sports Commission Chairman William Ramirez on the p...",,,,-44
Juliette Uy,,339957112804069,POLITICIAN,,First-ever lady legislator representing the 2nd district of Misamis Oriental. Vice President for Social Development of the National Unity Party (NUP).,2016-03-10 22:01:13 SGT,931,N/A,2017-05-26 18:18:04 SGT,2017-05-26,18:18:04,Photo,3,3,0,0,0,0,0,0,0,0,,-,0,0,0,N/A,https://www.facebook.com/339957112804069/posts/1067179423415164,"The Committee on Tourism of the House of Representatives has recently approved a measure that aims to declare the province of Misamis Oriental as a tourism development area. Misamis Oriental Rep. Juliette Uy (2nd District), author of House Bill 2128 titled An Act Declaring the Province of Misamis Oriental as a Tourism Development Area and Appropriating Funds Therefor, profusely thanked Leyte Rep. Lucy Torres-Gomez, Tourism Committee Chair for the panel's approval of the measure. You may also look at this link: http://www.congress.gov.ph/photojournal/zoom.php?photoid=1201",https://www.facebook.com/339957112804069/photos/a.1067179023415204/1067179050081868/?type=3,,,House Committee on Tourism,"The Committee on Tourism of the House of Representatives has recently approved a measure that aims to declare the province of Misamis Oriental as a tourism development area.

Misamis Oriental Rep. Juliette Uy (2nd District), author of House Bill 2128 titled An Act Declaring the Province of Misamis Oriental as a Tourism Development Area and Appropriating Funds Therefor, profusely thanked Leyte Rep. Lucy Torres-Gomez, Tourism Committee Chair for the panel's approval of the measure. You may also look at this link: http://www.congress.gov.ph/photojournal/zoom.php?photoid=1201",,,,-15
Erin Tañada,erintanada,299365322449,POLITICIAN,PH,"Atty. Lorenzo ""Erin"" Tañada III-- Liberal Party Vice President for External Affairs, human rights lawyer, former Deputy Speaker and Quezon Representative. ",2018-10-16 21:33:26 SGT,N/A,N/A,2012-09-12 19:21:43 SGT,2012-09-12,19:21:43,Link,3,3,0,0,0,0,0,0,0,0,,-,0,0,0,N/A,https://www.facebook.com/299365322449/posts/435092426530068,"""House Speaker Feliciano Belmonte, Jr. presents to Atty. Leni Robredo, widow of the late Interior and Local Government Secretary Jesse M. Robredo, the Congressional Medal of Achievement in recognition of Sec. Robredo's exemplary accomplishments in the promotion of good governance, tempered by honesty, integrity and creativity in public service. Mrs. Robredo, with daughter Jillian, was also presented a copy of House Resolution 280 which specifically cited the late Secretary's lifetime achievements as Naga City Mayor for 18 years and as Secretary of the DILG, among others.""",http://www.congress.gov.ph/photojournal/zoom.php?photoid=718,,,House of Representatives - 15th Congress of the Philippines,description,,,,-160
Balitang San Jose del Monte Bulacan,,170754190895983,none,,,2020-07-25 01:15:54 SGT,44192,N/A,2021-02-19 23:18:10 SGT,2021-02-19,23:18:10,Photo,3,1,0,0,2,0,0,0,0,0,,-,0,0,0,N/A,https://www.facebook.com/groups/170754190895983/permalink/439470390691027,,https://www.facebook.com/madeinsjdm/photos/a.2232448987082679/2837793969881508/?type=3,,,Made in SJDM,"The House Committee on People’s Participation chaired by San Jose Del Monte City Rep. Florida Robes held an online discussion Thursday with the Russian Federation Embassy for an update on the status of Russia’s vaccine for COVID-19. In her opening remarks, Robes said achieving the goal of immunizing Filipinos against the COVID-19 disease to definite courses of government action has become more imperative not only for the country to recover from the economic slump but to save lives as well. She stressed the importance of people’s participation in the COVID-19 vaccination program. “Dahil ang people’s participation ay naguugnay sa lahat ng klase ng tao, mayaman man o mahirap, at higit sa lahat, ang civil society o ang nasa gobyerno,” she said.

#WorkingCongresswoman

https://www.congress.gov.ph/photojournal/zoom.php?photoid=2846",,,,-47.67
Beng Climaco,bengclimaco,96666303013,GOVERNMENT OFFICIAL,PH,"MARIA ISABELLE 'BENG' G. CLIMACO -  Mayor, City Government of Zamboanga",2016-04-13 00:27:51 SGT,N/A,N/A,2011-05-27 20:44:27 SGT,2011-05-27,20:44:27,Link,3,3,0,0,0,0,0,0,0,0,,-,0,0,0,N/A,https://www.facebook.com/96666303013/posts/176499355736473,"From left: Rep. Karlo Alexei Nograles, Deputy Speakers Beng Climaco and Pablo Garcia, Speaker Belmonte, Ambassador Lillie, Mr. Wilson, Deputy Speaker Lorenzo Tañada III, Reps. Ramon Durano VI and Rene Relampagos.",http://www.congress.gov.ph/photojournal/zoom.php?photoid=560,,,Photo Journal - House of Representatives of the Philippines,"Speaker Feliciano Belmonte, Jr. (4th from left) led House members in welcoming United Kingdom Ambassador Stephen Lillie (center) and Mr. Peter Wilson (6th from left), head of the Asia Pacific Department of the UK Foreign and Commonwealth Office, during their courtesy call at the House of Representat...",,,,-126.67
IGLESIA NI CRISTO VS CATHOLIC DEBATE >  Debate Forum Warzone (OPEN FORUM),,1835489580056163,none,,,2020-03-11 15:34:04 SGT,N/A,N/A,2018-12-02 12:04:39 SGT,2018-12-02,12:04:39,Photo,3,1,0,1,1,0,0,0,0,0,,-,0,0,0,N/A,https://www.facebook.com/groups/1835489580056163/permalink/2263458713925912,Mga kato!liko ito na yung hinahanap nyong batas,https://www.facebook.com/photo.php?fbid=1992073004140051&set=p.1992073004140051&type=3,,,Arkade,"#Repost #SDAK

INC ANNIVERSARY bilang NON-WORKING HOLIDAY, PASADO sa KAMARA 😊

INAPRUBAHAN na sa ikatlo at huling pagbasa ang panukalang batas na ibilang na special non-working holiday ang anibersaryo ng Iglesia ni Cristo (INC).

Batay sa House Bill 5686, tuwing anibersaryo ng Iglesia Ni Cristo na July 27 ay idedeklara itong non-working holiday.

Ang pagpapasa sa panukala ay isinagawa kaalinsabay ng ika-103 taong anibersaryo ng INC na inaprubahan ng may 242 kongresista.

Ang panukalang ito ay pinagsama-samang panukala nina Reps. Winston Castelo (PDP-Laban, Quezon City); Alfred Vargas (PDP-Laban, QC); Eugene de Vera (ABS Partylist); Gil P. Acosta (NP, Palawan); Gus Tambunting (PDP-Laban, Parañaque City) at Romeo Acop (LP, Antipolo City).

Sinabi ni Castelo na inaamyendahan ng HB 5686 ang Republic Act No. 9645 o mas kilala bilang Commemoration of the Founding Anniversary of Iglesia Ni Cristo Act, sa pamamagitan ng pagdedeklara ng July 27 bilang non-working holiday.

Paliwanag ni Castelo, chairman ng House Committee on Metro Manila Development, ito’y upang mabigyan ng pagkakataon ang mga Pilipino na miembro ng INC na maipagdiwang ang anibersaryo tuwing July 27.

Samantala, naipasa na sa Committee on Rules ang House Resolution 1163 na nagpapahatid ng pagbati sa ika-103 anibersaryo ng Iglesia Ni Cristo nitong nagdaang July 27, 2017 at ang House Resolution 1167 na nagpapahatid naman ng pagbati sa walong taong matagumpay na pangunguna ni Iglesia Ni Cristo Executive Minister Eduardo V. Manalo. 

Related :
http://www.congress.gov.ph/legisdocs/third_17/HBT5686.pdf
http://www.congress.gov.ph/legisdocs/first_17/CR00250.pdf
http://www.congress.gov.ph/photojournal/zoom.php?photoid=1254&key=House%20Bill%205686
http://www.abante-tonite.com/inc-anniv-idineklarang-holiday.htm
© Access The Truth",,,,-15.33
Alliance of Volunteer Educators (AVE),avepartylist,242984482845,NON-GOVERNMENTAL ORGANIZATION (NGO),PH,"AVE Party-List …  ""Edukasyon ay Karapatan, Pananagutan ng Bayan!""",2021-02-14 14:22:25 SGT,N/A,N/A,2011-02-21 18:06:24 SGT,2011-02-21,18:06:24,Link,3,1,2,0,0,0,0,0,0,0,,-,0,0,0,N/A,https://www.facebook.com/242984482845/posts/154948967893935,http://www.congress.gov.ph/photojournal/zoom.php?photoid=522:=:https://www.congress.gov.ph/photojournal/zoom.php?photoid=522,http://www.congress.gov.ph/photojournal/zoom.php?photoid=522,https://www.congress.gov.ph/photojournal/zoom.php?photoid=522,,Photo Journal - House of Representatives of the Philippines,"Speaker Feliciano Belmonte Jr. warmly receives the distinguished members of an Iranian delegation headed by H.E. Mr. Hassan Ghashghavi, Deputy Minister of Consular and Parliamentary and Iranian Affairs, Ministry of Foreign Affairs of the Islamic Republic of Iran, who paid a courtesy call on the Hous",,,,-33.33
PMMA ALL CLASS,,78234554607,none,,,2020-03-13 14:16:37 SGT,N/A,N/A,2014-03-06 11:59:24 SGT,2014-03-06,11:59:24,Link,2,2,0,0,0,0,0,0,0,0,,-,0,0,0,N/A,https://www.facebook.com/groups/78234554607/permalink/10152060406194608,,http://www.congress.gov.ph/photojournal/zoom.php?photoid=877,,,HOUSE OF REPRESENTATIVES | 16th Congress of the Philippines,"� you are here �&raquo Home �&raquo Photo Journals Photo credit: Gilbert Engay, Media Relations Service-PRIB Speaker Feliciano Belmonte, Jr. signs the House of Representatives and Senate-ratified consolidated bill promoting competency and proficiency among Filipino seafarers and ensuring the country...",,,,-0.88
ComNet Mountain Province,,1674296762641071,GOVERNMENT ORGANIZATION,PH,"The Provincial Information Office is tasked to manage a responsive public information system; thereby, creating public awareness vital to development.",2021-01-15 10:16:47 SGT,N/A,N/A,2020-09-20 15:33:21 SGT,2020-09-20,15:33:21,Link,2,2,0,0,0,0,0,0,0,0,,-,0,0,0,N/A,https://www.facebook.com/1674296762641071/posts/4349453231792064,"Re: PROPOSED ""MEDIA WORKERS WELFARE ACT"" http://www.congress.gov.ph/photojournal/zoom.php?photoid=2524",http://www.congress.gov.ph/photojournal/zoom.php?photoid=2524,,,House of Representatives Photo Journals,House of Representatives Photo Journals,,,,0
Representative Lucy Torres-Gomez,LucyMarieTorresGomez,422281474541399,POLITICIAN,,"The Official Page Of Leyte's 4th District Representative, Lucy Torres-Gomez",2016-11-23 22:19:24 SGT,39489,40895,2019-09-24 09:04:32 SGT,2019-09-24,09:04:32,Link,2,2,0,0,0,0,0,0,0,0,,-,0,0,0,N/A,https://www.facebook.com/422281474541399/posts/1936582893111242,"The House Committee on Disaster Management, in a hearing presided by its Chairperson Rep. Lucy Torres-Gomez, was briefed today by Department of the Interior and Local Government Assistant Secretary Felix Castro on the current status of the Marawi Rehabilitation, headed by Task Force Bangon Marawi. The task force is composed of 56 government agencies tasked by the President to rehabilitate Marawi after it was devastated by terrorism that lasted for 5 months and affected 114,000 families. The total amount of funds earmarked for the rehabilitation is P13.1 billion, which is expected to be completed by the end of 2021.",http://www.congress.gov.ph/photojournal/zoom.php?photoid=2134,,,House of Representatives,"The House Committee on Disaster Management, in a hearing presided by its Chairperson Rep. Lucy Torres-Gomez, was briefed today by Department of the Interior and Local Government Assistant Secretary Felix Castro on the current status of the Marawi Rehabilitation, headed by Task Force Bangon Marawi. T...",,,,-139.5
"Congressman Roberto ""Robbie"" Puno",congrobbiepuno,107899175910288,GOVERNMENT OFFICIAL,PH,Government Official,2018-03-31 09:28:25 SGT,N/A,N/A,2014-06-30 16:39:00 SGT,2014-06-30,16:39:00,Link,2,2,0,0,0,0,0,0,0,0,,-,0,0,0,N/A,https://www.facebook.com/107899175910288/posts/791349120898620,[ADMIN] Andray Blatche pays a courtesy visit to the Office of Speaker Feliciano Belmote. http://www.congress.gov.ph/photojournal/zoom.php?photoid=898,http://www.congress.gov.ph/photojournal/zoom.php?photoid=898,,,HOUSE OF REPRESENTATIVES | 16th Congress of the Philippines,"TOWERING WITH CONFIDENCEPhoto credit: Gilbert Engay, Media Relations Service-PRIB11 June 2014 07:02:45 PMSpeaker Feliciano Belmonte, Jr. and ranking members and leaders of the House of Representatives are dwarfed by Gilas Pilipinas' newest member, Brooklyn Nets center Andray Blatche. He paid a court…",,,,-45
Beng Climaco,bengclimaco,96666303013,GOVERNMENT OFFICIAL,PH,"MARIA ISABELLE 'BENG' G. CLIMACO -  Mayor, City Government of Zamboanga",2016-04-13 00:27:51 SGT,N/A,N/A,2011-06-17 08:03:19 SGT,2011-06-17,08:03:19,Link,2,2,0,0,0,0,0,0,0,0,,-,0,0,0,N/A,https://www.facebook.com/96666303013/posts/180144838710035,"The record of the just ended 1st regular session of the 15th Congress only proved that the 285 members of the House of Representatives, as Speaker Feliciano Belmonte, Jr. declared, are united by an ""overwhelming yearning to end poverty, accelerate economic and social development, and to restore integrity and efficiency in public service.""",http://www.congress.gov.ph/photojournal/zoom.php?photoid=571,,,Photo Journal - House of Representatives of the Philippines,"The record of the just ended 1st regular session of the 15th Congress only proved that the 285 members of the House of Representatives, as Speaker Feliciano Belmonte, Jr. declared, are united by an ""overwhelming yearning to end poverty, accelerate economic and social development, and to restore inte",,,,-190
PH Watch,phwatchers,694272533931088,COMMUNITY,PH,Your source of REAL News,2019-02-26 00:35:35 SGT,15939,15869,2019-03-31 14:11:16 SGT,2019-03-31,14:11:16,Link,1,1,0,0,0,0,0,0,0,0,,-,0,0,0,N/A,https://www.facebook.com/694272533931088/posts/3036153863076265,,http://www.congress.gov.ph/photojournal/zoom.php?photoid=1883,,,This is a re-share of a post,"NO ZEROS WHEN IT COMES TO DISTRICT ALLOCATIONS REGARDLESS OF HOW THE REPRESENTATIVE VOTED

That was the instruction of former President and now House Speaker Gloria Macapagal-Arroyo, Rep. Rolando Andaya Jr., Chairman of House Committee on Appropriations said in the press briefing last Monday. 
“Mission accomplished na kami. Simula’t sapul naman lagi naman sinasabi ng ating Speaker na nais natin na magkaroon ng bagong budget at ito na nga po, detalyado at pinapakita sa lahat ang mga napuntahan ng mga pondo ng iba’t ibang departamento. So, for us, mission accomplished. Siguro hindi naman question ang legal ngayon, question lang kung gusto mo o hindi,” said Andaya. He added that their itemization of lump sum funds agreed during the bicameral conference committee was done “equitably” regardless of the House Members’ political affiliation.   

http://www.congress.gov.ph/photojournal/zoom.php?photoid=1883",,,,-37
Cagayan Valley Bloggers Society,CagayanValleyBloggers,225002194210994,NON-GOVERNMENTAL ORGANIZATION (NGO),PH,Official Fanpage of Cagayan Valley Bloggers Society (CVBSi) | Promote the 5 provinces and 4 cities of Cagayan Valley Region thru blogging and social media.,2020-07-25 03:45:36 SGT,N/A,N/A,2020-01-29 21:19:43 SGT,2020-01-29,21:19:43,Link,1,0,0,1,0,0,0,0,0,0,,-,0,0,0,N/A,https://www.facebook.com/225002194210994/posts/2963565857021267,"The House Committee on Cooperatives Development chaired by Rep. Sabiniano S. Canama (Party-list, COOP NATCCO) on Monday hosted the four-day celebration of Cooperative Week with the theme “105 Years of Cooperative Heritage” from January 27 to 30, 2020. #Cooperatives #105YearsOfCooperativeHeritage #LighthouseCooperative #HouseOfRepresentatives",http://www.congress.gov.ph/photojournal/zoom.php?photoid=2261,,,This is a re-share of a post,"The House Committee on Cooperatives Development chaired by Rep. Sabiniano S. Canama (Party-list, COOP NATCCO) on Monday hosted the four-day celebration of Cooperative Week with the theme “105 Years of Cooperative Heritage” from January 27 to 30, 2020. #Cooperatives #105YearsOfCooperativeHeritage #LighthouseCooperative #HouseOfRepresentatives 
http://www.congress.gov.ph/photojournal/zoom.php?photoid=2261",,,,-0.92
CoRRECT™ Movement Moderated Public Forum,,2526024247716069,none,,,2020-07-24 21:41:33 SGT,10522,N/A,2021-02-02 19:33:30 SGT,2021-02-02,19:33:30,Photo,1,1,0,0,0,0,0,0,0,0,,-,0,0,0,N/A,https://www.facebook.com/groups/2526024247716069/permalink/2885143848470772,,https://www.facebook.com/luciferouslogophile/photos/a.411894925817628/1455008321506278/?type=3,,,Luminous by Trixie Cruz-Angeles & Ahmed Paglinawan,"Hah! Once again Luminous was right. Former SC Justice Adolf Azcuna cautions the use of ""Unless otherwise provided by law"" and recommends review of their placements

The former justice says that if placed at the end it may make reference to all previous clauses. 

The phrase can and SHOULD only be used for the flexible portions of the economic provisions (i.e. nationality requirements).and not for the permanently protected provisions (i.e. national parks and timber lands) 

Congress removed Sec. 7 of RBH2 which allows foreign ownership of land. If it adheres to J. Azcuna's admonition, we can minimize Congress' discretion. Ideally, the provisions should state that Congress can determine the nationality requirements for each industry. 

The senate, however is a different story. 

Source: https://www.congress.gov.ph/photojournal/zoom.php?photoid=2792",,,,-101
